SHROPSHIRE COMMUNITY HEALTH NHS TRUST (R1D),Community,92764.0,,70135.0,22629.0,109267.0,126349.0,132455.0,159938.0,115606.0,111628.0,92764.0,The Access Group
SOLENT NHS TRUST (R1C),Mental Health and Community (Combined),93654.0,,62480.0,31174.0,124983.0,122788.0,128422.0,91189.0,103258.0,82697.0,93654.0,TPP
SOMERSET NHS FOUNDATION TRUST (RH5),Acute,1598190.0,4.62,1598190.0,0.0,60798.0,59963.0,80835.0,79180.0,879134.0,836686.0,1598190.0,IMS Maxims Ltd
SOUTH CENTRAL AMBULANCE SERVICE NHS FOUNDATION TRUST (RYE),Ambulance,0.0,,0.0,0.0,0.0,0.0,0.0,0.0,0.0,0.0,0.0,Ortivus UK Ltd
SOUTH EAST COAST AMBULANCE SERVICE NHS FOUNDATION TRUST (RYD),Ambulance,0.0,,0.0,0.0,0.0,0.0,0.0,0.0,0.0,0.0,0.0,Cleric Computer Services Ltd
SOUTH LONDON AND MAUDSLEY NHS FOUNDATION TRUST (RV5),Mental Health,0.0,,0.0,0.0,0.0,0.0,0.0,0.0,0.0,0.0,0.0,Advanced Health and Care Limited
SOUTH TEES HOSPITALS NHS FOUNDATION TRUST (RTR),Acute,2591143.0,6.25,1760522.0,830621.0,1219317.0,1452180.0,1728982.0,1997634.0,2113451.0,2144025.0,2591143.0,Alcidion
SOUTH TYNESIDE AND SUNDERLAND NHS FOUNDATION TRUST (R0B),Acute,1683830.0,3.64,528858.0,1154972.0,0.0,0.0,2009382.0,1615888.0,994550.0,960446.0,1683830.0,Meditech Group Limited
SOUTH WARWICKSHIRE UNIVERSITY NHS FOUNDATION TRUST (RJC),Acute,1092090.0,4.11,130902.0,961188.0,547083.0,1027335.0,1116373.0,1069984.0,1069984.0,1069984.0,1092090.0,Dedalus Healthcare Ltd
SOUTH WEST LONDON AND ST GEORGE'S MENTAL HEALTH NHS TRUST (RQY),Mental Health,0.0,,0.0,0.0,0.0,0.0,0.0,0.0,0.0,0.0,0.0,The Access Group
SOUTH WEST YORKSHIRE PARTNERSHIP NHS FOUNDATION TRUST (RXG),Mental Health and Community (Combined),179085.0,,88315.0,90770.0,189120.0,174709.0,220783.0,181882.0,193031.0,182422.0,179085.0,TPP
SOUTH WESTERN AMBULANCE SERVICE NHS FOUNDATION TRUST (RYF),Ambulance,0.0,,0.0,0.0,0.0,0.0,0.0,0.0,0.0,0.0,0.0,Ortivus UK Ltd
SOUTHERN HEALTH NHS FOUNDATION TRUST (RW1),Mental Health and Community (Combined),197531.0,,197531.0,0.0,214640.0,220007.0,153342.0,182304.0,200000.0,198493.0,197531.0,The Access Group
ST GEORGE'S UNIVERSITY HOSPITALS NHS FOUNDATION TRUST (RJ7),Acute,3061798.0,6.82,1020703.0,2041095.0,886429.0,752000.0,515525.0,656152.0,614000.0,807364.0,3061798.0,Oracle Cerner Corporation
STOCKPORT NHS FOUNDATION TRUST (RWJ),Acute,2265920.0,6.83,18311.0,2247609.0,54558.0,427727.0,482304.0,1727340.0,1741114.0,1991944.0,2265920.0,No EPR -  in process of getting one
SURREY AND BORDERS PARTNERSHIP NHS FOUNDATION TRUST (RXX),Mental Health,60000.0,,60000.0,0.0,500000.0,520000.0,200000.0,100.0,100.0,60000.0,60000.0,TPP
SURREY AND SUSSEX HEALTHCARE NHS TRUST (RTP),Acute,1985829.0,4.3,401512.0,1584317.0,1869494.0,2111631.0,2150523.0,2144017.0,2468527.0,2663547.0,1985829.0,Oracle Cerner Corporation
SUSSEX COMMUNITY NHS FOUNDATION TRUST (RDR),Community,375844.0,,66382.0,309462.0,395533.0,411357.0,403036.0,391453.0,389106.0,428887.0,375844.0,TPP
SUSSEX PARTNERSHIP NHS FOUNDATION TRUST (RX2),Mental Health,227961.0,,227961.0,0.0,336088.0,218464.0,208449.0,184135.0,219792.0,187386.0,227961.0,Advanced Health and Care Limited
TAMESIDE AND GLOSSOP INTEGRATED CARE NHS FOUNDATION TRUST (RMP),Acute,975665.0,3.95,111844.0,863821.0,186378.0,1092978.0,1129094.0,1011511.0,940769.0,927485.0,975665.0,Dedalus Healthcare Ltd
TAVISTOCK AND PORTMAN NHS FOUNDATION TRUST (RNK),Mental Health,31000.0,,10000.0,21000.0,40000.0,25300.0,25500.0,25500.0,21000.0,21000.0,31000.0,Advanced Health and Care Limited
"TEES, ESK AND WEAR VALLEYS NHS FOUNDATION TRUST (RX3)",Mental Health,414418.0,,233487.0,180931.0,309611.0,309611.0,309611.0,349000.0,349000.0,359061.0,414418.0,Civica UK Limited
THE CHRISTIE NHS FOUNDATION TRUST (RBV),Acute,302197.0,,80589.0,221608.0,156867.0,218610.0,282298.0,225909.0,190975.0,183356.0,302197.0,Generic or In House EPR Provider
THE CLATTERBRIDGE CANCER CENTRE NHS FOUNDATION TRUST (REN),Acute,73968.0,,45274.0,28694.0,58000.0,104977.0,82551.0,73878.0,82528.0,68704.0,73968.0,Meditech Group Limited
THE DUDLEY GROUP NHS FOUNDATION TRUST (RNA),Acute,1656858.0,4.16,0.0,1656858.0,1679781.0,1700002.0,2548336.0,1847541.0,1661319.0,1719628.0,1656858.0,Altera Digital Health
THE HILLINGDON HOSPITALS NHS FOUNDATION TRUST (RAS),Acute,1085276.0,3.51,461956.0,623320.0,460210.0,1178947.0,1333238.0,1298313.0,1335389.0,1377584.0,1085276.0,Oracle Cerner Corporation
THE NEWCASTLE UPON TYNE HOSPITALS NHS FOUNDATION TRUST (RTD),Acute,1798114.0,4.97,978739.0,819375.0,2096096.0,2317668.0,1844521.0,2417824.0,2403186.0,2676497.0,1798114.0,Oracle Cerner Corporation
THE PRINCESS ALEXANDRA HOSPITAL NHS TRUST (RQW),Acute,1159170.0,3.53,58477.0,1100693.0,938114.0,1051918.0,1113255.0,1156571.0,1217303.0,1127157.0,1159170.0,Cambio Healthcare Systems Ltd
"THE QUEEN ELIZABETH HOSPITAL, KING'S LYNN, NHS FOUNDATION TRUST (RCX)",Acute,743174.0,2.98,53358.0,689816.0,506993.0,514604.0,770260.0,791753.0,540286.0,714685.0,743174.0,No EPR -  in process of getting one
THE ROBERT JONES AND AGNES HUNT ORTHOPAEDIC HOSPITAL NHS FOUNDATION TRUST (RL1),Acute,249046.0,,26016.0,223030.0,266525.0,295026.0,274362.0,264433.0,272425.0,289032.0,249046.0,No EPR -  in process of getting one
THE ROTHERHAM NHS FOUNDATION TRUST (RFR),Acute,1580130.0,5.96,91697.0,1488433.0,1098012.0,1319820.0,1477896.0,1645386.0,1672831.0,1694490.0,1580130.0,Meditech Group Limited
THE ROYAL MARSDEN NHS FOUNDATION TRUST (RPY),Acute,303000.0,,105000.0,198000.0,284268.0,305212.0,328391.0,314852.0,294693.0,321231.0,303000.0,Epic Systems Corporation
THE ROYAL ORTHOPAEDIC HOSPITAL NHS FOUNDATION TRUST (RRJ),Acute,560629.0,,16126.0,544503.0,364457.0,417998.0,439100.0,456374.0,469768.0,575543.0,560629.0,No EPR -  in process of getting one
THE ROYAL WOLVERHAMPTON NHS TRUST (RL4),Acute,1010914.0,2.35,60997.0,949917.0,444136.0,469666.0,518462.0,548649.0,804701.0,911075.0,1010914.0,No EPR -  in process of getting one
THE SHREWSBURY AND TELFORD HOSPITAL NHS TRUST (RXW),Acute,1139974.0,2.34,243533.0,896441.0,351115.0,478800.0,553505.0,629325.0,641665.0,977588.0,1139974.0,System C Healthcare Ltd
THE WALTON CENTRE NHS FOUNDATION TRUST (RET),Acute,118528.0,,45325.0,73203.0,106988.0,69940.0,127383.0,131096.0,83333.0,79179.0,118528.0,Generic or In House EPR Provider
TORBAY AND SOUTH DEVON NHS FOUNDATION TRUST (RA9),Acute,2421116.0,8.72,49464.0,2371652.0,1195013.0,1242560.0,1731766.0,1775404.0,2016459.0,2204210.0,2421116.0,No EPR -  in process of getting one
UNITED LINCOLNSHIRE HOSPITALS NHS TRUST (RWD),Acute,3480695.0,5.77,539012.0,2941683.0,2980034.0,3112695.0,3097331.0,3206654.0,3277299.0,3456420.0,3480695.0,No EPR -  in process of getting one
UNIVERSITY COLLEGE LONDON HOSPITALS NHS FOUNDATION TRUST (RRV),Acute,1989597.0,7.34,604585.0,1385012.0,3849996.0,3899378.0,3075147.0,2652459.0,2469940.0,2642102.0,1989597.0,Epic Systems Corporation
UNIVERSITY HOSPITAL SOUTHAMPTON NHS FOUNDATION TRUST (RHM),Acute,977665.0,2.09,185534.0,792131.0,1589458.0,1438245.0,1370371.0,994727.0,933328.0,911746.0,977665.0,Generic or In House EPR Provider
UNIVERSITY HOSPITALS BIRMINGHAM NHS FOUNDATION TRUST (RRK),Acute,4081450.0,3.09,44737.0,4036713.0,1694633.0,3183624.0,5033656.0,5125979.0,5128160.0,3910422.0,4081450.0,Generic or In House EPR Provider
UNIVERSITY HOSPITALS BRISTOL AND WESTON NHS FOUNDATION TRUST (RA7),Acute,3433734.0,7.05,253013.0,3180721.0,445102.0,449725.0,452751.0,1134217.0,1130771.0,1239297.0,3433734.0,System C Healthcare Ltd
UNIVERSITY HOSPITALS COVENTRY AND WARWICKSHIRE NHS TRUST (RKB),Acute,1582431.0,3.12,1582431.0,0.0,2400000.0,2500000.0,2397786.0,1611715.0,1671926.0,2702189.0,1582431.0,Oracle Cerner Corporation
UNIVERSITY HOSPITALS DORSET NHS FOUNDATION TRUST (R0D),Acute,1545171.0,2.69,227047.0,1318124.0,0.0,0.0,0.0,2041186.0,1747262.0,1703847.0,1545171.0,Graphnet Health Ltd
UNIVERSITY HOSPITALS OF DERBY AND BURTON NHS FOUNDATION TRUST (RTG),Acute,5074281.0,6.02,4515960.0,558321.0,2832857.0,4674838.0,4828195.0,4876921.0,4725591.0,4758087.0,5074281.0,Dedalus Healthcare Ltd
UNIVERSITY HOSPITALS OF LEICESTER NHS TRUST (RWE),Acute,3399056.0,3.42,943096.0,2455960.0,1479554.0,2646807.0,2775178.0,673314.0,2734223.0,3145506.0,3399056.0,Nervecentre Software Ltd
UNIVERSITY HOSPITALS OF MORECAMBE BAY NHS FOUNDATION TRUST (RTX),Acute,668441.0,1.89,668441.0,0.0,1106548.0,938253.0,927861.0,857635.0,889653.0,704253.0,668441.0,Dedalus Healthcare Ltd
UNIVERSITY HOSPITALS OF NORTH MIDLANDS NHS TRUST (RJE),Acute,1352155.0,2.05,343478.0,1008677.0,2163818.0,1205235.0,1292514.0,1325081.0,1331438.0,1348596.0,1352155.0,System C Healthcare Ltd
UNIVERSITY HOSPITALS PLYMOUTH NHS TRUST (RK9),Acute,3828057.0,8.46,149191.0,3678866.0,1110228.0,1336401.0,1600912.0,2457339.0,2512169.0,3790452.0,3828057.0,No EPR -  in process of getting one
UNIVERSITY HOSPITALS SUSSEX NHS FOUNDATION TRUST (RYR),Acute,5480595.0,5.41,3200340.0,2280255.0,2738018.0,2539402.0,2471959.0,2150931.0,5190934.0,4762311.0,5480595.0,Generic or In House EPR Provider
WALSALL HEALTHCARE NHS TRUST (RBK),Acute,1800964.0,6.83,442836.0,1358128.0,1198802.0,1477968.0,1434427.0,1510729.0,1441427.0,1516524.0,1800964.0,System C Healthcare Ltd
WARRINGTON AND HALTON TEACHING HOSPITALS NHS FOUNDATION TRUST (RWW),Acute,810046.0,2.96,326837.0,483209.0,801258.0,865325.0,923613.0,860564.0,604285.0,795272.0,810046.0,Dedalus Healthcare Ltd
WEST HERTFORDSHIRE TEACHING HOSPITALS NHS TRUST (RWG),Acute,1123377.0,2.41,625714.0,497663.0,1243433.0,1442012.0,1437745.0,1380377.0,1418745.0,1634164.0,1123377.0,Oracle Cerner Corporation
WEST LONDON NHS TRUST (RKL),Mental Health and Community (Combined),179026.0,,114660.0,64366.0,188596.0,217115.0,165113.0,182556.0,233396.0,194111.0,179026.0,TPP
WEST MIDLANDS AMBULANCE SERVICE UNIVERSITY NHS FOUNDATION TRUST (RYA),Ambulance,0.0,,0.0,0.0,0.0,0.0,0.0,0.0,0.0,0.0,0.0,Cleric Computer Services Ltd
WEST SUFFOLK NHS FOUNDATION TRUST (RGR),Acute,1074054.0,3.86,0.0,1074054.0,1137179.0,1305402.0,845278.0,804335.0,744661.0,879508.0,1074054.0,Oracle Cerner Corporation
WHITTINGTON HEALTH NHS TRUST (RKE),Acute,844030.0,3.92,78200.0,765830.0,342382.0,890152.0,1100339.0,862848.0,1109776.0,810326.0,844030.0,System C Healthcare Ltd
WIRRAL COMMUNITY HEALTH AND CARE NHS FOUNDATION TRUST (RY7),Community,46755.0,,46755.0,0.0,0.0,0.0,59803.0,33777.0,34090.0,31282.0,46755.0,TPP
WIRRAL UNIVERSITY TEACHING HOSPITAL NHS FOUNDATION TRUST (RBL),Acute,281644.0,0.82,45959.0,235685.0,990424.0,982303.0,913455.0,213326.0,273686.0,226969.0,281644.0,Oracle Cerner Corporation
WORCESTERSHIRE ACUTE HOSPITALS NHS TRUST (RWP),Acute,846569.0,1.47,102091.0,744478.0,423683.0,409692.0,568527.0,2055000.0,1913484.0,0.0,846569.0,Altera Digital Health
"WRIGHTINGTON, WIGAN AND LEIGH NHS FOUNDATION TRUST (RRF)",Acute,762116.0,2.58,44332.0,717784.0,560326.0,644678.0,681800.0,617330.0,606359.0,789055.0,762116.0,Altera Digital Health
WYE VALLEY NHS TRUST (RLQ),Acute,1177228.0,5.75,237992.0,939236.0,816698.0,917276.0,1171791.0,1110520.0,1087129.0,1212241.0,1177228.0,IMS Maxims Ltd
YORK AND SCARBOROUGH TEACHING HOSPITALS NHS FOUNDATION TRUST (RCB),Acute,2510729.0,4.7,127042.0,2383687.0,2755771.0,2260620.0,2131466.0,2441768.0,2293257.0,2032564.0,2510729.0,Generic or In House EPR Provider
YORKSHIRE AMBULANCE SERVICE NHS TRUST (RX8),Ambulance,0.0,,0.0,0.0,0.0,0.0,0.0,0.0,0.0,0.0,0.0,Generic or In House EPR Provider
